{
  "$schema": "./workbench-dependency-risk-inventory.v1.schema.json",
  "schemaVersion": "lotus-workbench.dependency-risk-inventory.v1",
  "inventoryId": "lotus-workbench-direct-production-dependencies",
  "inventoryVersion": "1.1.0",
  "governedByIssue": "https://github.com/sgajbi/lotus-workbench/issues/618",
  "reviewedOn": "2026-08-12",
  "nextReviewBy": "2026-11-10",
  "admissionMode": "blocking",
  "reviewOwner": "workbench-architecture-maintainers",
  "platformPolicy": {
    "contractId": "lotus-platform-technology-governance-policy",
    "contractVersion": "1.0.0",
    "sourceRepository": "https://github.com/sgajbi/lotus-platform",
    "sourceRevision": "2868348d289fc685ecf5a218b6c73256ac3a7742",
    "sourcePath": "platform-contracts/technology-governance/lotus-technology-governance-policy.v1.json",
    "lifecycleStatus": "report_only",
    "localAdoptionDecision": "blocking_direct_production_dependency_admission"
  },
  "allowedLicenses": [
    "Apache-2.0",
    "MIT"
  ],
  "dependencies": [
    {
      "name": "@emotion/cache",
      "version": "11.14.0",
      "technologyState": "approved_default",
      "purpose": "Provides the deterministic Emotion cache used by the official MUI App Router server-rendering integration.",
      "ownershipBoundary": "Workbench owns cache placement and hydration invariants; Emotion owns style serialization and cache mechanics.",
      "architecturalRole": "design_system",
      "criticality": "high",
      "containmentBoundary": "Consumed only by the MUI Next.js integration at the root application boundary, not by business screens.",
      "replacementPosture": {
        "strategy": "adapter_contained",
        "exitPath": "Replace only with the paired MUI styling-engine or framework integration while preserving head-managed SSR style and hydration proof.",
        "switchingCost": "moderate"
      },
      "license": {
        "spdx": "MIT",
        "evidenceUrl": "https://www.npmjs.com/package/@emotion/cache/v/11.14.0"
      },
      "stewardship": {
        "steward": "Emotion maintainers",
        "repositoryUrl": "https://github.com/emotion-js/emotion",
        "securityChannelUrl": "https://github.com/emotion-js/emotion/security/advisories"
      },
      "lifecycle": {
        "releaseChannel": "stable",
        "maintenanceStatus": "active",
        "releaseEvidenceUrl": "https://github.com/emotion-js/emotion/releases"
      },
      "maturity": {
        "rationale": "Stable official Emotion cache package required by MUI's documented Next.js App Router integration.",
        "adoptionEvidenceUrls": [
          "https://mui.com/material-ui/integrations/nextjs/",
          "https://emotion.sh/docs/@emotion/cache"
        ]
      },
      "review": {
        "owner": "workbench-architecture-maintainers",
        "reviewedOn": "2026-08-12",
        "nextReviewBy": "2026-11-10"
      },
      "exception": null
    },
    {
      "name": "@emotion/react",
      "version": "11.14.0",
      "technologyState": "approved_default",
      "purpose": "Provides the React styling runtime required by the governed MUI component foundation.",
      "ownershipBoundary": "Workbench owns its MUI theme and component usage; Emotion owns the styling engine implementation.",
      "architecturalRole": "design_system",
      "criticality": "high",
      "containmentBoundary": "Consumed as an MUI peer runtime behind the Workbench design-system theme and component boundary.",
      "replacementPosture": {
        "strategy": "retain_and_review",
        "exitPath": "Replace only through an issue-backed MUI styling-engine migration with visual and accessibility regression proof.",
        "switchingCost": "high"
      },
      "license": {
        "spdx": "MIT",
        "evidenceUrl": "https://www.npmjs.com/package/@emotion/react/v/11.14.0"
      },
      "stewardship": {
        "steward": "Emotion maintainers",
        "repositoryUrl": "https://github.com/emotion-js/emotion",
        "securityChannelUrl": "https://github.com/emotion-js/emotion/security/advisories"
      },
      "lifecycle": {
        "releaseChannel": "stable",
        "maintenanceStatus": "active",
        "releaseEvidenceUrl": "https://github.com/emotion-js/emotion/releases"
      },
      "maturity": {
        "rationale": "Established styling runtime used by MUI with stable package documentation and an active public maintenance channel.",
        "adoptionEvidenceUrls": [
          "https://mui.com/material-ui/integrations/styled-components/",
          "https://emotion.sh/docs/introduction"
        ]
      },
      "review": {
        "owner": "workbench-architecture-maintainers",
        "reviewedOn": "2026-08-10",
        "nextReviewBy": "2026-11-10"
      },
      "exception": null
    },
    {
      "name": "@emotion/styled",
      "version": "11.14.1",
      "technologyState": "approved_default",
      "purpose": "Provides the styled-component primitive required by the governed MUI styling engine.",
      "ownershipBoundary": "Workbench owns design tokens and composed components; Emotion owns styled-component runtime behavior.",
      "architecturalRole": "design_system",
      "criticality": "high",
      "containmentBoundary": "Consumed as an MUI peer runtime behind the Workbench design-system theme and component boundary.",
      "replacementPosture": {
        "strategy": "retain_and_review",
        "exitPath": "Replace only with the paired Emotion and MUI migration, including theme, rendering, and accessibility proof.",
        "switchingCost": "high"
      },
      "license": {
        "spdx": "MIT",
        "evidenceUrl": "https://www.npmjs.com/package/@emotion/styled/v/11.14.1"
      },
      "stewardship": {
        "steward": "Emotion maintainers",
        "repositoryUrl": "https://github.com/emotion-js/emotion",
        "securityChannelUrl": "https://github.com/emotion-js/emotion/security/advisories"
      },
      "lifecycle": {
        "releaseChannel": "stable",
        "maintenanceStatus": "active",
        "releaseEvidenceUrl": "https://github.com/emotion-js/emotion/releases"
      },
      "maturity": {
        "rationale": "Established MUI-compatible styling primitive with stable documentation and a shared active Emotion maintenance channel.",
        "adoptionEvidenceUrls": [
          "https://mui.com/material-ui/integrations/styled-components/",
          "https://emotion.sh/docs/styled"
        ]
      },
      "review": {
        "owner": "workbench-architecture-maintainers",
        "reviewedOn": "2026-08-10",
        "nextReviewBy": "2026-11-10"
      },
      "exception": null
    },
    {
      "name": "@hookform/resolvers",
      "version": "5.2.2",
      "technologyState": "approved_default",
      "purpose": "Connects governed Zod validation to React Hook Form in the proposal simulation workflow.",
      "ownershipBoundary": "Workbench owns form rules and schemas; the adapter owns translation into React Hook Form results.",
      "architecturalRole": "form_adapter",
      "criticality": "moderate",
      "containmentBoundary": "Imported only by the proposal simulation form and paired with repository-owned Zod schemas.",
      "replacementPosture": {
        "strategy": "adapter_contained",
        "exitPath": "Replace with a repository-owned resolver adapter or direct validation at the proposal form boundary.",
        "switchingCost": "low"
      },
      "license": {
        "spdx": "MIT",
        "evidenceUrl": "https://www.npmjs.com/package/@hookform/resolvers/v/5.2.2"
      },
      "stewardship": {
        "steward": "React Hook Form maintainers",
        "repositoryUrl": "https://github.com/react-hook-form/resolvers",
        "securityChannelUrl": "https://github.com/react-hook-form/resolvers/security/advisories"
      },
      "lifecycle": {
        "releaseChannel": "stable",
        "maintenanceStatus": "active",
        "releaseEvidenceUrl": "https://github.com/react-hook-form/resolvers/releases/tag/v5.2.2"
      },
      "maturity": {
        "rationale": "Official React Hook Form resolver collection with stable Zod integration and active public releases.",
        "adoptionEvidenceUrls": [
          "https://github.com/react-hook-form/resolvers",
          "https://react-hook-form.com/get-started#SchemaValidation"
        ]
      },
      "review": {
        "owner": "workbench-architecture-maintainers",
        "reviewedOn": "2026-08-10",
        "nextReviewBy": "2026-11-10"
      },
      "exception": null
    },
    {
      "name": "@mui/material",
      "version": "7.3.4",
      "technologyState": "approved_default",
      "purpose": "Provides accessible interaction primitives and theme integration for the Workbench design system.",
      "ownershipBoundary": "Workbench owns business composition, tokens, density, and interaction policy; MUI owns low-level primitives.",
      "architecturalRole": "design_system",
      "criticality": "high",
      "containmentBoundary": "Business screens consume repository-owned design-system components; direct use is governed and reviewed.",
      "replacementPosture": {
        "strategy": "framework_migration",
        "exitPath": "Migrate through the Workbench design-system facade screen by screen with accessibility and visual-regression proof.",
        "switchingCost": "high"
      },
      "license": {
        "spdx": "MIT",
        "evidenceUrl": "https://www.npmjs.com/package/@mui/material/v/7.3.4"
      },
      "stewardship": {
        "steward": "MUI Core maintainers",
        "repositoryUrl": "https://github.com/mui/material-ui",
        "securityChannelUrl": "https://github.com/mui/material-ui/security/policy"
      },
      "lifecycle": {
        "releaseChannel": "stable",
        "maintenanceStatus": "active",
        "releaseEvidenceUrl": "https://github.com/mui/material-ui/releases/tag/v7.3.4"
      },
      "maturity": {